{
  "name": "avatar-spokesperson",
  "version": "1.0",
  "description": "디지털 발표자 앵커 파이프라인: 대본→아바타 샷/CTA 게이트 계획→립싱크 아바타 렌더·복제 음성(tts)·자막 자산→캡션/CTA 편집→립싱크 합성→게시. provider는 하드코딩 없이 javis_select 위임(avatar·tts 무료·로컬 바닥부터). render_runtime은 edit에 고정되고 무음 swap은 CRITICAL 위반(SF-RENDER-RUNTIME-SWAP).",
  "phases": [
    {
      "id": "idea",
      "skill": "youtube-video-pipeline",
      "produces": ["brief.md"],
      "success_criteria": {
        "statement": "앵커 페르소나·플랫폼·CTA 목표를 반영한 브리프를 작성한다(범위·CTA 섹션 포함).",
        "checks": [
          {"kind": "section_present", "value": "범위", "statement": "범위 섹션 존재"},
          {"kind": "section_present", "value": "CTA", "statement": "CTA 목표 섹션 존재"}
        ]
      },
      "review_focus": ["persona-clarity", "cta-goal-defined"],
      "human_approval_default": true,
      "max_revisions": 3,
      "budget_minutes": 15
    },
    {
      "id": "script",
      "skill": "script-writer",
      "produces": ["script.json"],
      "success_criteria": {
        "statement": "발표자 대사 라인과 명시적 CTA 라인을 담은 대본을 산출한다(립싱크·tts의 단일 진실).",
        "checks": [
          {"kind": "json_valid", "statement": "script.json 파싱"},
          {"kind": "field_present", "value": "lines", "statement": "대사 라인 배열 필드 존재"},
          {"kind": "min_items", "value": {"field": "lines", "min": 2}, "statement": "대사 라인 ≥2(빈 대본 차단)"},
          {"kind": "field_present", "value": "cta", "statement": "CTA 라인 필드 존재(CTA 게이트 토대)"}
        ]
      },
      "review_focus": ["spokesperson-voice", "cta-explicit"],
      "human_approval_default": true,
      "max_revisions": 3,
      "budget_minutes": 20
    },
    {
      "id": "scene-plan",
      "skill": "video-stitch",
      "produces": ["scene_plan.json"],
      "success_criteria": {
        "statement": "대본 라인을 아바타 샷에 매핑하고 CTA 게이트 배치(노출 위치·지속)를 계획한다.",
        "checks": [
          {"kind": "json_valid", "statement": "scene_plan.json 파싱"},
          {"kind": "field_present", "value": "shots", "statement": "아바타 샷 배열 필드 존재"},
          {"kind": "min_items", "value": {"field": "shots", "min": 2}, "statement": "아바타 샷 ≥2(샷 커버리지)"}
        ]
      },
      "review_focus": ["shot-line-mapping", "cta-gate-placement"],
      "human_approval_default": false,
      "max_revisions": 3,
      "budget_minutes": 15
    },
    {
      "id": "assets",
      "skill": "voice-clone-elevenlabs",
      "produces": ["asset_manifest.json"],
      "success_criteria": {
        "statement": "립싱크 아바타 렌더·복제 음성(tts·javis_select로 provider 선택)·자막 자산을 준비한다. 아바타/음성 미가용 시 정직하게 강등.",
        "checks": [
          {"kind": "json_valid", "statement": "asset_manifest.json 파싱"}
        ]
      },
      "review_focus": ["lipsync-quality", "voice-consistency", "caption-readability"],
      "human_approval_default": false,
      "max_revisions": 3,
      "budget_minutes": 30
    },
    {
      "id": "edit",
      "skill": "video-stitch-captions",
      "produces": ["edit_decisions.json"],
      "success_criteria": {
        "statement": "자막 스타일·CTA 오버레이 배치·아바타 트림 편집 결정을 산출한다. render_runtime을 명시 고정(무음 swap=위반·SF-RENDER-RUNTIME-SWAP).",
        "checks": [
          {"kind": "json_valid", "statement": "edit_decisions.json 파싱"},
          {"kind": "field_present", "value": "render_runtime", "statement": "render_runtime 명시 고정(무음 swap 방지·SF-RENDER-RUNTIME-SWAP)"}
        ]
      },
      "review_focus": ["caption-styling", "cta-overlay-timing", "render-runtime-locked"],
      "human_approval_default": false,
      "max_revisions": 3,
      "budget_minutes": 15
    },
    {
      "id": "compose",
      "skill": "video-verify",
      "produces": ["render_report.json"],
      "success_criteria": {
        "statement": "립싱크 합성·오디오믹스 후 render_report를 산출한다. render_runtime은 edit_decisions 고정값과 일치해야 하며(무음 swap=CRITICAL 위반) 립싱크 정합·ffprobe 통과를 기록한다.",
        "checks": [
          {"kind": "json_valid", "statement": "render_report.json 파싱"},
          {"kind": "field_present", "value": "render_runtime", "statement": "render_report에 사용 런타임 기록(edit 고정값 대조·무음 swap 검출·SF-RENDER-RUNTIME-SWAP)"}
        ]
      },
      "review_focus": ["render-runtime-match", "lipsync-sync", "playable"],
      "human_approval_default": true,
      "max_revisions": 5,
      "budget_minutes": 30
    },
    {
      "id": "publish",
      "skill": "youtube-video-pipeline",
      "produces": ["publish_log.json"],
      "success_criteria": {
        "statement": "메타데이터·익스포트 패키지(또는 게시 URL)를 산출한다.",
        "checks": [
          {"kind": "json_valid", "statement": "publish_log.json 파싱"}
        ]
      },
      "review_focus": ["metadata-complete"],
      "human_approval_default": false,
      "max_revisions": 2,
      "budget_minutes": 10
    }
  ]
}
