{
  "name": "character-animation",
  "version": "1.0",
  "description": "로컬 캐릭터 리그/포즈/SVG/Canvas 모션 기반 캐릭터 애니메이션 파이프라인(원격 video-gen 대체 아님·대부분 신규 능력). research→proposal→script→character-design→rig-plan→scene-plan→assets→edit→compose→publish. provider는 하드코딩 없이 javis_select 위임(무료·로컬 바닥부터). render_runtime은 proposal/edit에 고정되고 무음 swap은 CRITICAL 위반(SF-RENDER-RUNTIME-SWAP).",
  "phases": [
    {
      "id": "research",
      "skill": "youtube-video-pipeline",
      "produces": ["brief.md"],
      "success_criteria": {
        "statement": "캐릭터 컨셉·타깃 플랫폼·레퍼런스 모션 스타일을 조사한 브리프를 작성한다(범위·출처 섹션 포함).",
        "checks": [
          {"kind": "section_present", "value": "범위", "statement": "범위 섹션 존재"},
          {"kind": "section_present", "value": "출처", "statement": "출처 섹션 존재"},
          {"kind": "min_sources", "value": 2, "statement": "레퍼런스 출처 ≥2(근거 강제)"}
        ]
      },
      "review_focus": ["scope-clarity", "reference-grounding"],
      "human_approval_default": true,
      "max_revisions": 3,
      "budget_minutes": 20
    },
    {
      "id": "proposal",
      "skill": "youtube-video-pipeline",
      "produces": ["brief.md"],
      "success_criteria": {
        "statement": "캐릭터·모션 접근(리그/SVG/Canvas)과 render_runtime 선택을 확정한 제안 브리프를 작성한다(범위·런타임 섹션 포함). render_runtime은 여기서 고정되고 이후 무음 swap은 위반.",
        "checks": [
          {"kind": "section_present", "value": "범위", "statement": "범위 섹션 존재"},
          {"kind": "section_present", "value": "런타임", "statement": "render_runtime 결정 섹션 존재"}
        ]
      },
      "review_focus": ["motion-approach-fit", "render-runtime-decided"],
      "human_approval_default": true,
      "max_revisions": 3,
      "budget_minutes": 15
    },
    {
      "id": "script",
      "skill": "script-writer",
      "produces": ["script.json"],
      "success_criteria": {
        "statement": "캐릭터 대사·나레이션·비트로 구성된 스크립트를 산출한다(beats 배열 포함).",
        "checks": [
          {"kind": "json_valid", "statement": "script.json 파싱"},
          {"kind": "field_present", "value": "beats", "statement": "스크립트 비트 배열 존재"},
          {"kind": "min_items", "value": {"field": "beats", "min": 2}, "statement": "비트 ≥2(빈 스크립트 차단)"}
        ]
      },
      "review_focus": ["beat-clarity", "character-voice-consistency"],
      "human_approval_default": false,
      "max_revisions": 3,
      "budget_minutes": 20
    },
    {
      "id": "character-design",
      "skill": "media-gen-image",
      "produces": ["character_design.json"],
      "success_criteria": {
        "statement": "등장 캐릭터별 비주얼 시트(턴어라운드·팔레트·SVG 파츠)를 산출한다(characters 배열 포함). 생성 이미지는 javis_select로 provider 선택(무료·로컬 바닥).",
        "checks": [
          {"kind": "json_valid", "statement": "character_design.json 파싱"},
          {"kind": "field_present", "value": "characters", "statement": "캐릭터 배열 존재"},
          {"kind": "min_items", "value": {"field": "characters", "min": 1}, "statement": "캐릭터 ≥1(빈 디자인 차단)"}
        ]
      },
      "review_focus": ["design-consistency", "rig-readiness"],
      "human_approval_default": false,
      "max_revisions": 3,
      "budget_minutes": 25
    },
    {
      "id": "rig-plan",
      "skill": "media-gen-image",
      "produces": ["rig_plan.json"],
      "success_criteria": {
        "statement": "캐릭터별 본/조인트·포즈 라이브러리·디포메이션 계획을 산출한다(rigs 배열 포함). character_design 파츠와 정합.",
        "checks": [
          {"kind": "json_valid", "statement": "rig_plan.json 파싱"},
          {"kind": "field_present", "value": "rigs", "statement": "리그 배열 존재"},
          {"kind": "min_items", "value": {"field": "rigs", "min": 1}, "statement": "리그 ≥1(빈 리그 차단)"}
        ]
      },
      "review_focus": ["bone-hierarchy-valid", "pose-coverage"],
      "human_approval_default": false,
      "max_revisions": 3,
      "budget_minutes": 25
    },
    {
      "id": "scene-plan",
      "skill": "video-stitch-compositing",
      "produces": ["scene_plan.json"],
      "success_criteria": {
        "statement": "스크립트 비트를 씬으로 매핑하고 캐릭터 배치·카메라·모션 타임라인을 계획한다(scenes 배열 포함).",
        "checks": [
          {"kind": "json_valid", "statement": "scene_plan.json 파싱"},
          {"kind": "field_present", "value": "scenes", "statement": "씬 배열 존재"},
          {"kind": "min_items", "value": {"field": "scenes", "min": 2}, "statement": "씬 ≥2(모션 커버리지)"}
        ]
      },
      "review_focus": ["beat-to-scene-coverage", "motion-feasibility"],
      "human_approval_default": false,
      "max_revisions": 3,
      "budget_minutes": 20
    },
    {
      "id": "assets",
      "skill": "voice-clone-elevenlabs",
      "produces": ["asset_manifest.json"],
      "success_criteria": {
        "statement": "보이스(tts)·배경음악(music)·캐릭터 스프라이트/SVG·오디오 정규화를 준비한다(assets 배열 포함). tts·music·이미지는 javis_select로 provider 선택(무키 로컬 바닥).",
        "checks": [
          {"kind": "json_valid", "statement": "asset_manifest.json 파싱"},
          {"kind": "field_present", "value": "assets", "statement": "자산 배열 존재"},
          {"kind": "min_items", "value": {"field": "assets", "min": 1}, "statement": "자산 ≥1(빈 매니페스트 차단)"}
        ]
      },
      "review_focus": ["voice-character-match", "music-mood-fit", "asset-completeness"],
      "human_approval_default": false,
      "max_revisions": 3,
      "budget_minutes": 30
    },
    {
      "id": "edit",
      "skill": "video-stitch-compositing",
      "produces": ["edit_decisions.json"],
      "success_criteria": {
        "statement": "씬별 모션 타이밍·트랜지션·립싱크/포즈 키프레임·오디오 믹스 편집 결정을 산출한다. render_runtime을 proposal 고정값과 일치하게 명시 고정(무음 swap=위반·SF-RENDER-RUNTIME-SWAP).",
        "checks": [
          {"kind": "json_valid", "statement": "edit_decisions.json 파싱"},
          {"kind": "field_present", "value": "render_runtime", "statement": "render_runtime 명시 고정(무음 swap 방지·SF-RENDER-RUNTIME-SWAP)"}
        ]
      },
      "review_focus": ["motion-timing-naturalness", "render-runtime-locked"],
      "human_approval_default": false,
      "max_revisions": 3,
      "budget_minutes": 20
    },
    {
      "id": "compose",
      "skill": "video-verify",
      "produces": ["render_report.json"],
      "success_criteria": {
        "statement": "캐릭터 모션 합성·오디오믹스 후 render_report를 산출한다. render_runtime은 edit_decisions 고정값과 일치해야 하며(무음 swap=CRITICAL 위반·SF-RENDER-RUNTIME-SWAP) ffprobe·시각 QA 통과를 기록한다.",
        "checks": [
          {"kind": "json_valid", "statement": "render_report.json 파싱"},
          {"kind": "field_present", "value": "render_runtime", "statement": "render_report에 사용 런타임 기록(edit 고정값 대조·무음 swap 검출·SF-RENDER-RUNTIME-SWAP)"}
        ]
      },
      "review_focus": ["render-runtime-match", "playable", "visual-qa-pass"],
      "human_approval_default": true,
      "max_revisions": 5,
      "budget_minutes": 35
    },
    {
      "id": "publish",
      "skill": "youtube-video-pipeline",
      "produces": ["publish_log.json"],
      "success_criteria": {
        "statement": "메타데이터·익스포트 패키지(또는 게시 URL)를 산출한다.",
        "checks": [
          {"kind": "json_valid", "statement": "publish_log.json 파싱"}
        ]
      },
      "review_focus": ["metadata-complete"],
      "human_approval_default": false,
      "max_revisions": 2,
      "budget_minutes": 10
    }
  ]
}
