{
  "name": "podcast-repurpose",
  "version": "1.0",
  "description": "팟캐스트 1개를 오디오그램·인용 숏클립·동반영상으로 재가공하는 파이프라인. transcription→화자분리(diarization)→인용 세그먼트 랭킹→캡션/오디오그램 자산→배치 편집→합성. provider는 하드코딩 없이 javis_select 위임(무키 whisperx 전사 바닥), render_runtime은 edit에 고정되고 무음 swap은 위반.",
  "phases": [
    {
      "id": "idea",
      "skill": "youtube-video-pipeline",
      "produces": ["brief.md"],
      "success_criteria": {
        "statement": "팟캐스트 에피소드·출력 포맷 믹스(오디오그램/인용 클립/동반영상)·플랫폼 타깃을 정의한다(범위·포맷 섹션 포함).",
        "checks": [
          {"kind": "section_present", "value": "범위", "statement": "범위 섹션 존재"},
          {"kind": "section_present", "value": "포맷", "statement": "출력 포맷 믹스 섹션 존재"}
        ]
      },
      "review_focus": ["format-mix-clear", "platform-fit"],
      "human_approval_default": true,
      "max_revisions": 3,
      "budget_minutes": 15
    },
    {
      "id": "script",
      "skill": "transcription",
      "produces": ["transcript.json"],
      "success_criteria": {
        "statement": "javis_select로 전사 provider 선택(무키 whisperx 바닥) 후 화자분리(diarization) 라벨을 단 타임스탬프 전사를 산출한다. 모든 타임스탬프는 소스 경계 안.",
        "checks": [
          {"kind": "json_valid", "statement": "transcript.json 파싱(화자 라벨+타임스탬프)"},
          {"kind": "field_present", "value": "segments", "statement": "전사 세그먼트 필드 존재"},
          {"kind": "min_items", "value": {"field": "segments", "min": 1}, "statement": "세그먼트 ≥1(빈 전사 차단)"}
        ]
      },
      "review_focus": ["timestamp-accuracy", "speaker-diarization", "no-hallucinated-fills"],
      "human_approval_default": false,
      "max_revisions": 3,
      "budget_minutes": 25
    },
    {
      "id": "scene-plan",
      "skill": "video-stitch",
      "produces": ["scene_plan.json"],
      "success_criteria": {
        "statement": "인용 가치가 높은 자기완결 세그먼트를 랭킹해 인용 클립/오디오그램 후보를 식별한다(깔끔한 in/out 경계). 후보 클립 ≥ 브리프 타깃.",
        "checks": [
          {"kind": "json_valid", "statement": "scene_plan.json 파싱(clips 배열 포함)"},
          {"kind": "field_present", "value": "clips", "statement": "후보 인용 클립 배열 존재"},
          {"kind": "min_items", "value": {"field": "clips", "min": 2}, "statement": "후보 클립 ≥2(인용 클립 floor·정확한 수는 리뷰)"}
        ]
      },
      "review_focus": ["clean-boundaries", "quote-worthiness", "self-contained-clips"],
      "human_approval_default": false,
      "max_revisions": 3,
      "budget_minutes": 20
    },
    {
      "id": "assets",
      "skill": "caption-align",
      "produces": ["asset_manifest.json"],
      "success_criteria": {
        "statement": "단어 단위 자막(caption-align)·오디오그램 파형/배경·오디오 정규화·필요 BGM을 준비한다(자막 cues 산출). 생성 자산은 javis_select로 provider 선택.",
        "checks": [
          {"kind": "json_valid", "statement": "asset_manifest.json 파싱"},
          {"kind": "field_present", "value": "cues", "statement": "단어 단위 자막 cues 필드 존재"},
          {"kind": "min_items", "value": {"field": "cues", "min": 1}, "statement": "자막 cues ≥1(빈 자막 차단)"}
        ]
      },
      "review_focus": ["caption-readability", "audiogram-waveform", "audio-normalized"],
      "human_approval_default": false,
      "max_revisions": 3,
      "budget_minutes": 25
    },
    {
      "id": "edit",
      "skill": "video-stitch",
      "produces": ["edit_decisions.json"],
      "success_criteria": {
        "statement": "포맷별(오디오그램·인용 클립·동반영상) 자막 스타일·트림·BGM 믹스 편집 결정을 산출한다. render_runtime을 명시 고정(무음 swap=위반·SF-RENDER-RUNTIME-SWAP).",
        "checks": [
          {"kind": "json_valid", "statement": "edit_decisions.json 파싱"},
          {"kind": "field_present", "value": "render_runtime", "statement": "render_runtime 명시 고정(무음 swap 방지·SF-RENDER-RUNTIME-SWAP)"}
        ]
      },
      "review_focus": ["caption-styling", "music-mix", "render-runtime-locked"],
      "human_approval_default": false,
      "max_revisions": 3,
      "budget_minutes": 20
    },
    {
      "id": "compose",
      "skill": "video-verify",
      "produces": ["render_report.json"],
      "success_criteria": {
        "statement": "오디오그램·인용 클립·동반영상을 배치 합성·오디오믹스 후 render_report를 산출한다. render_runtime은 edit_decisions 고정값과 일치해야 하며(무음 swap=위반) 모든 출력이 ffprobe·시각 QA를 통과한다.",
        "checks": [
          {"kind": "json_valid", "statement": "render_report.json 파싱(출력별 결과 포함)"},
          {"kind": "field_present", "value": "render_runtime", "statement": "사용 런타임 기록(edit 고정값 대조·무음 swap 검출·SF-RENDER-RUNTIME-SWAP)"},
          {"kind": "min_items", "value": {"field": "results", "min": 2}, "statement": "출력별 결과 ≥2(전 산출물 렌더 floor)"}
        ]
      },
      "review_focus": ["render-runtime-match", "all-outputs-rendered", "playable", "visual-qa-pass"],
      "human_approval_default": true,
      "max_revisions": 5,
      "budget_minutes": 35
    },
    {
      "id": "publish",
      "skill": "youtube-video-pipeline",
      "produces": ["publish_log.json"],
      "success_criteria": {
        "statement": "포맷·플랫폼별 메타데이터로 익스포트 패키지(또는 게시 URL)를 산출한다.",
        "checks": [
          {"kind": "json_valid", "statement": "publish_log.json 파싱"}
        ]
      },
      "review_focus": ["per-format-metadata"],
      "human_approval_default": false,
      "max_revisions": 2,
      "budget_minutes": 10
    }
  ]
}
