{
  "name": "screen-demo",
  "version": "1.0",
  "description": "화면녹화/합성 터미널 풋티지를 콜아웃·줌·자막 데모 영상으로 만드는 스크린데모 파이프라인. screen-capture→transcription→scene-cut(콜아웃/줌 플래닝)→caption→합성. provider는 하드코딩 없이 javis_select 위임(무키 whisperx 전사 바닥). render_runtime은 edit에 고정되고 compose에서 대조하며 무음 swap은 CRITICAL 위반(SF-RENDER-RUNTIME-SWAP).",
  "phases": [
    {
      "id": "idea",
      "skill": "youtube-video-pipeline",
      "produces": ["brief.md"],
      "success_criteria": {
        "statement": "데모할 화면/제품·핵심 콜아웃 포인트·목표 길이를 반영한 브리프를 작성한다(범위·타깃 섹션 포함).",
        "checks": [
          {"kind": "section_present", "value": "범위", "statement": "범위 섹션 존재"},
          {"kind": "section_present", "value": "타깃", "statement": "타깃 섹션 존재"}
        ]
      },
      "review_focus": ["scope-clarity", "callout-points-listed"],
      "human_approval_default": true,
      "max_revisions": 3,
      "budget_minutes": 15
    },
    {
      "id": "script",
      "skill": "transcription",
      "produces": ["transcript.json"],
      "success_criteria": {
        "statement": "javis_select로 전사 provider 선택(무키 whisperx 바닥) 후 화면녹화 내레이션의 단어 단위 타임스탬프 전사를 산출한다. 모든 타임스탬프는 소스 경계 안.",
        "checks": [
          {"kind": "json_valid", "statement": "transcript.json 파싱"},
          {"kind": "field_present", "value": "segments", "statement": "전사 세그먼트 필드 존재"},
          {"kind": "min_items", "value": {"field": "segments", "min": 1}, "statement": "세그먼트 ≥1(빈 전사 차단)"}
        ]
      },
      "review_focus": ["timestamp-accuracy", "no-hallucinated-fills"],
      "human_approval_default": false,
      "max_revisions": 3,
      "budget_minutes": 20
    },
    {
      "id": "scene-plan",
      "skill": "scene-cut",
      "produces": ["scene_plan.json"],
      "success_criteria": {
        "statement": "화면녹화 전 구간을 씬(scenes)으로 분할하고 각 씬에 콜아웃·줌 타깃·전환 지점을 계획한다. 줌/콜아웃 좌표는 소스 프레임 안.",
        "checks": [
          {"kind": "json_valid", "statement": "scene_plan.json 파싱"},
          {"kind": "field_present", "value": "scenes", "statement": "씬/컷 계획 필드 존재"},
          {"kind": "min_items", "value": {"field": "scenes", "min": 2}, "statement": "씬 ≥2(콜아웃/줌 커버리지)"}
        ]
      },
      "review_focus": ["callout-target-accuracy", "zoom-feasibility", "cut-coverage"],
      "human_approval_default": false,
      "max_revisions": 3,
      "budget_minutes": 20
    },
    {
      "id": "assets",
      "skill": "caption-align",
      "produces": ["asset_manifest.json"],
      "success_criteria": {
        "statement": "전사 타임스탬프에 정렬된 자막 큐(cues)·콜아웃/줌 오버레이 자산·오디오 정규화를 준비한다. 생성 자산은 javis_select로 provider 선택.",
        "checks": [
          {"kind": "json_valid", "statement": "asset_manifest.json 파싱"},
          {"kind": "field_present", "value": "cues", "statement": "자막 큐 필드 존재"},
          {"kind": "min_items", "value": {"field": "cues", "min": 1}, "statement": "자막 큐 ≥1(빈 자막 차단)"}
        ]
      },
      "review_focus": ["caption-readability", "caption-timing-aligned", "overlay-legibility"],
      "human_approval_default": false,
      "max_revisions": 3,
      "budget_minutes": 20
    },
    {
      "id": "edit",
      "skill": "video-stitch",
      "produces": ["edit_decisions.json"],
      "success_criteria": {
        "statement": "콜아웃/줌 키프레임·자막 스타일·컷 트림·오디오 설정 편집 결정을 산출한다. render_runtime을 명시 고정(이후 compose가 대조·무음 swap=위반·SF-RENDER-RUNTIME-SWAP).",
        "checks": [
          {"kind": "json_valid", "statement": "edit_decisions.json 파싱"},
          {"kind": "field_present", "value": "render_runtime", "statement": "render_runtime 명시 고정(무음 swap 방지·SF-RENDER-RUNTIME-SWAP)"}
        ]
      },
      "review_focus": ["zoom-motion-smoothness", "callout-sync", "render-runtime-locked"],
      "human_approval_default": false,
      "max_revisions": 3,
      "budget_minutes": 20
    },
    {
      "id": "compose",
      "skill": "video-verify",
      "produces": ["render_report.json"],
      "success_criteria": {
        "statement": "콜아웃/줌/자막 합성·오디오믹스 후 render_report를 산출한다. render_runtime은 edit_decisions의 고정값과 일치해야 하며(무음 swap=CRITICAL 위반) ffprobe·시각 QA 통과를 기록한다.",
        "checks": [
          {"kind": "json_valid", "statement": "render_report.json 파싱"},
          {"kind": "field_present", "value": "render_runtime", "statement": "render_report에 사용 런타임 기록(edit 고정값 대조·무음 swap 검출)"}
        ]
      },
      "review_focus": ["render-runtime-match", "callout-zoom-rendered", "playable", "visual-qa-pass"],
      "human_approval_default": true,
      "max_revisions": 5,
      "budget_minutes": 30
    },
    {
      "id": "publish",
      "skill": "youtube-video-pipeline",
      "produces": ["publish_log.json"],
      "success_criteria": {
        "statement": "메타데이터·익스포트 패키지(또는 게시 URL)를 산출한다.",
        "checks": [
          {"kind": "json_valid", "statement": "publish_log.json 파싱"}
        ]
      },
      "review_focus": ["metadata-complete"],
      "human_approval_default": false,
      "max_revisions": 2,
      "budget_minutes": 10
    }
  ]
}
