{
  "name": "talking-head",
  "version": "1.0",
  "description": "발표자 raw footage를 전사→점프컷→캡션→합성하는 엔드투엔드 토킹헤드 파이프라인(최저예산 베이스라인). provider는 하드코딩 없이 javis_select로 선택(무료·로컬 바닥부터). render_runtime은 proposal에 고정되고 무음 swap은 CRITICAL 위반.",
  "phases": [
    {
      "id": "idea",
      "skill": "youtube-video-pipeline",
      "produces": ["brief.md"],
      "success_criteria": {
        "statement": "footage 내용·플랫폼·목표 길이를 반영한 브리프를 작성한다(범위·타깃·완료조건 섹션 포함).",
        "checks": [
          {"kind": "section_present", "value": "범위", "statement": "범위 섹션 존재"},
          {"kind": "section_present", "value": "타깃", "statement": "타깃 섹션 존재"}
        ]
      },
      "review_focus": ["scope-clarity", "platform-fit"],
      "human_approval_default": true,
      "max_revisions": 3,
      "budget_minutes": 15
    },
    {
      "id": "script",
      "skill": "transcription",
      "produces": ["transcript.json"],
      "success_criteria": {
        "statement": "javis_select로 전사 provider 선택(무키 whisperx 바닥) 후 단어 단위 타임스탬프 전사를 산출한다. 모든 타임스탬프는 소스 경계 안.",
        "checks": [
          {"kind": "json_valid", "statement": "transcript.json 파싱"},
          {"kind": "field_present", "value": "segments", "statement": "전사 세그먼트 필드 존재"},
          {"kind": "min_items", "value": {"field": "segments", "min": 1}, "statement": "세그먼트 ≥1(빈 전사 차단)"}
        ]
      },
      "review_focus": ["timestamp-accuracy", "no-hallucinated-fills"],
      "human_approval_default": false,
      "max_revisions": 3,
      "budget_minutes": 20
    },
    {
      "id": "scene-plan",
      "skill": "video-stitch",
      "produces": ["scene_plan.json"],
      "success_criteria": {
        "statement": "전 구간 씬 커버리지·얼굴 위치/리프레임·침묵 기반 점프컷 계획을 산출한다.",
        "checks": [
          {"kind": "json_valid", "statement": "scene_plan.json 파싱"},
          {"kind": "field_present", "value": "scenes", "statement": "씬/컷 계획 필드 존재"},
          {"kind": "min_items", "value": {"field": "scenes", "min": 2}, "statement": "씬/컷 ≥2(점프컷 커버리지)"}
        ]
      },
      "review_focus": ["cut-coverage", "reframe-feasibility"],
      "human_approval_default": false,
      "max_revisions": 3,
      "budget_minutes": 15
    },
    {
      "id": "assets",
      "skill": "video-stitch-captions",
      "produces": ["asset_manifest.json"],
      "success_criteria": {
        "statement": "자막(caption)·오디오 정규화·필요 이미지를 준비한다. 생성 자산은 javis_select로 provider 선택.",
        "checks": [
          {"kind": "json_valid", "statement": "asset_manifest.json 파싱"}
        ]
      },
      "review_focus": ["caption-readability", "audio-normalized"],
      "human_approval_default": false,
      "max_revisions": 3,
      "budget_minutes": 20
    },
    {
      "id": "edit",
      "skill": "video-stitch",
      "produces": ["edit_decisions.json"],
      "success_criteria": {
        "statement": "침묵 점프컷·트림/속도·자막 스타일·오디오 설정 편집 결정을 산출한다. render_runtime을 명시 고정.",
        "checks": [
          {"kind": "json_valid", "statement": "edit_decisions.json 파싱"},
          {"kind": "field_present", "value": "render_runtime", "statement": "render_runtime 명시 고정(무음 swap 방지·SF-RENDER-RUNTIME-SWAP)"}
        ]
      },
      "review_focus": ["jump-cut-naturalness", "render-runtime-locked"],
      "human_approval_default": false,
      "max_revisions": 3,
      "budget_minutes": 15
    },
    {
      "id": "compose",
      "skill": "video-verify",
      "produces": ["render_report.json"],
      "success_criteria": {
        "statement": "합성·오디오믹스 후 render_report를 산출한다. render_runtime은 edit_decisions의 고정값과 일치해야 하며(무음 swap=CRITICAL 위반) ffprobe·시각 QA 통과를 기록한다.",
        "checks": [
          {"kind": "json_valid", "statement": "render_report.json 파싱"},
          {"kind": "field_present", "value": "render_runtime", "statement": "render_report에 사용 런타임 기록(edit 고정값 대조·무음 swap 검출)"}
        ]
      },
      "review_focus": ["render-runtime-match", "playable", "visual-qa-pass"],
      "human_approval_default": true,
      "max_revisions": 5,
      "budget_minutes": 30
    },
    {
      "id": "publish",
      "skill": "youtube-video-pipeline",
      "produces": ["publish_log.json"],
      "success_criteria": {
        "statement": "메타데이터·익스포트 패키지(또는 게시 URL)를 산출한다.",
        "checks": [
          {"kind": "json_valid", "statement": "publish_log.json 파싱"}
        ]
      },
      "review_focus": ["metadata-complete"],
      "human_approval_default": false,
      "max_revisions": 2,
      "budget_minutes": 10
    }
  ]
}
