{
  "name": "cinematic",
  "version": "1.0",
  "description": "무드 주도 트레일러/브랜드필름 파이프라인: 공급 footage를 토대로 생성 갭필(video-gen)·컬러그레이드·음악·자막·sfx를 입혀 시네마틱 무드를 완성한다. research→proposal→script→scene_plan→assets→edit→compose→publish. provider는 하드코딩 없이 javis_select로 선택(무료·로컬 바닥부터). render_runtime은 proposal/edit에 명시 고정되고 compose에서 대조하며 무음 swap은 CRITICAL 위반(SF-RENDER-RUNTIME-SWAP).",
  "phases": [
    {
      "id": "research",
      "skill": "script-writer-research",
      "produces": ["brief.md"],
      "success_criteria": {
        "statement": "타깃 무드·레퍼런스 톤·브랜드 가이드를 조사하고 출처를 근거로 무드보드 방향을 정리한다(무드·레퍼런스 섹션 포함).",
        "checks": [
          {"kind": "section_present", "value": "무드", "statement": "무드 섹션 존재"},
          {"kind": "section_present", "value": "레퍼런스", "statement": "레퍼런스 섹션 존재"},
          {"kind": "min_sources", "value": 2, "statement": "근거 출처 ≥2(무근거 무드 단정 차단)"}
        ]
      },
      "review_focus": ["mood-clarity", "reference-grounded"],
      "human_approval_default": true,
      "max_revisions": 3,
      "budget_minutes": 20
    },
    {
      "id": "proposal",
      "skill": "youtube-video-pipeline",
      "produces": ["brief.md"],
      "success_criteria": {
        "statement": "공급 footage 인벤토리·생성 갭필 범위·목표 길이/플랫폼·render_runtime 고정을 제안한다(범위·footage 섹션 포함). render_runtime은 여기서 명시 고정되고 이후 무음 swap은 위반.",
        "checks": [
          {"kind": "section_present", "value": "범위", "statement": "범위 섹션 존재"},
          {"kind": "section_present", "value": "footage", "statement": "공급 footage 인벤토리 섹션 존재"}
        ]
      },
      "review_focus": ["supply-vs-gapfill", "runtime-fixed-here"],
      "human_approval_default": true,
      "max_revisions": 3,
      "budget_minutes": 20
    },
    {
      "id": "script",
      "skill": "script-writer",
      "produces": ["script.json"],
      "success_criteria": {
        "statement": "무드 비트·내레이션/캡션·음악 큐를 담은 비트 단위 스크립트를 산출한다. 각 비트는 footage 또는 생성 갭필로 매핑된다.",
        "checks": [
          {"kind": "json_valid", "statement": "script.json 파싱"},
          {"kind": "field_present", "value": "beats", "statement": "스크립트 비트 필드 존재"},
          {"kind": "min_items", "value": {"field": "beats", "min": 2}, "statement": "비트 ≥2(빈 스크립트 차단)"}
        ]
      },
      "review_focus": ["beat-mood-fit", "beat-to-footage-mapping"],
      "human_approval_default": false,
      "max_revisions": 3,
      "budget_minutes": 25
    },
    {
      "id": "scene-plan",
      "skill": "video-stitch",
      "produces": ["scene_plan.json"],
      "success_criteria": {
        "statement": "비트별 씬을 구성하고 공급 footage 컷과 생성 갭필 샷을 배치하며 무드 전환/페이싱을 계획한다.",
        "checks": [
          {"kind": "json_valid", "statement": "scene_plan.json 파싱(scenes 배열 포함)"},
          {"kind": "field_present", "value": "scenes", "statement": "씬 계획 필드 존재"},
          {"kind": "min_items", "value": {"field": "scenes", "min": 2}, "statement": "씬 ≥2(무드 아크 커버리지)"}
        ]
      },
      "review_focus": ["mood-transition", "gapfill-vs-supply-coverage", "pacing"],
      "human_approval_default": false,
      "max_revisions": 3,
      "budget_minutes": 20
    },
    {
      "id": "assets",
      "skill": "media-gen-video",
      "produces": ["asset_manifest.json"],
      "success_criteria": {
        "statement": "갭필 footage 생성(video-gen·javis_select로 provider 선택, 무료·로컬 바닥)·음악·자막·sfx 자산을 준비한다. 모든 계획 씬에 자산이 존재한다.",
        "checks": [
          {"kind": "json_valid", "statement": "asset_manifest.json 파싱(assets 배열 포함)"},
          {"kind": "field_present", "value": "assets", "statement": "자산 배열 존재"},
          {"kind": "min_items", "value": {"field": "assets", "min": 2}, "statement": "자산 ≥2(빈 매니페스트 차단)"}
        ]
      },
      "review_focus": ["gapfill-quality", "music-mood-fit", "sfx-placement"],
      "human_approval_default": false,
      "max_revisions": 3,
      "budget_minutes": 35
    },
    {
      "id": "edit",
      "skill": "video-stitch",
      "produces": ["edit_decisions.json"],
      "success_criteria": {
        "statement": "컬러그레이드·컷 타이밍·음악 동기·자막 스타일·sfx 배치 편집 결정을 산출한다. render_runtime을 proposal 고정값과 일치하도록 명시 고정한다(무음 swap=위반·SF-RENDER-RUNTIME-SWAP).",
        "checks": [
          {"kind": "json_valid", "statement": "edit_decisions.json 파싱"},
          {"kind": "field_present", "value": "render_runtime", "statement": "render_runtime 명시 고정(proposal 대조·무음 swap 방지·SF-RENDER-RUNTIME-SWAP)"}
        ]
      },
      "review_focus": ["color-grade-consistency", "music-sync", "render-runtime-locked"],
      "human_approval_default": false,
      "max_revisions": 3,
      "budget_minutes": 25
    },
    {
      "id": "compose",
      "skill": "video-verify",
      "produces": ["render_report.json"],
      "success_criteria": {
        "statement": "합성·컬러그레이드 적용·오디오믹스 후 render_report를 산출한다. render_runtime은 edit_decisions의 고정값과 일치해야 하며(무음 swap=CRITICAL 위반) ffprobe·시각/오디오 QA 통과를 기록한다.",
        "checks": [
          {"kind": "json_valid", "statement": "render_report.json 파싱"},
          {"kind": "field_present", "value": "render_runtime", "statement": "render_report에 사용 런타임 기록(edit 고정값 대조·무음 swap 검출·SF-RENDER-RUNTIME-SWAP)"}
        ]
      },
      "review_focus": ["render-runtime-match", "color-grade-applied", "playable", "audio-qa-pass"],
      "human_approval_default": true,
      "max_revisions": 5,
      "budget_minutes": 35
    },
    {
      "id": "publish",
      "skill": "youtube-video-pipeline",
      "produces": ["publish_log.json"],
      "success_criteria": {
        "statement": "메타데이터·익스포트 패키지(또는 게시 URL)를 산출한다.",
        "checks": [
          {"kind": "json_valid", "statement": "publish_log.json 파싱"}
        ]
      },
      "review_focus": ["metadata-complete"],
      "human_approval_default": false,
      "max_revisions": 2,
      "budget_minutes": 10
    }
  ]
}
