{
  "name": "animated-explainer",
  "version": "1.0",
  "description": "토픽을 리서치-우선으로 검증한 뒤 내레이션+비주얼(이미지·다이어그램·모션)+음악 설명영상으로 만드는 파이프라인. research→proposal(승인 게이트)→script→scene-plan→assets→edit→compose→publish. provider는 하드코딩 없이 javis_select 위임(무료·로컬 바닥부터), render_runtime은 edit에 고정되고 무음 swap은 CRITICAL 위반.",
  "phases": [
    {
      "id": "research",
      "skill": "script-writer",
      "produces": ["research.md"],
      "success_criteria": {
        "statement": "토픽을 출처 기반으로 조사해 핵심 주장·근거·반론을 정리한 리서치 브리프를 작성한다(범위·출처 섹션 포함). 출처 없는 단정 금지.",
        "checks": [
          {"kind": "section_present", "value": "범위", "statement": "범위 섹션 존재"},
          {"kind": "section_present", "value": "출처", "statement": "출처 섹션 존재"},
          {"kind": "min_sources", "value": 2, "statement": "출처 ≥2(리서치-우선·환각 차단)"}
        ]
      },
      "review_focus": ["source-credibility", "scope-clarity", "no-unsupported-claims"],
      "human_approval_default": true,
      "max_revisions": 3,
      "budget_minutes": 25
    },
    {
      "id": "proposal",
      "skill": "script-writer",
      "produces": ["proposal.md"],
      "success_criteria": {
        "statement": "리서치를 토대로 영상 컨셉·앵글·목표 길이·비주얼 스타일을 제안한다(컨셉·스타일 섹션 포함). 인간 승인 게이트.",
        "checks": [
          {"kind": "section_present", "value": "컨셉", "statement": "컨셉 섹션 존재"},
          {"kind": "section_present", "value": "스타일", "statement": "비주얼 스타일 섹션 존재"}
        ]
      },
      "review_focus": ["concept-fit", "angle-clarity", "style-feasibility"],
      "human_approval_default": true,
      "max_revisions": 3,
      "budget_minutes": 20
    },
    {
      "id": "script",
      "skill": "script-writer",
      "produces": ["script.json"],
      "success_criteria": {
        "statement": "승인된 제안을 내레이션 대본으로 작성한다. narration 세그먼트 배열(문장·예상 길이)을 산출하며 모든 주장은 리서치 출처로 뒷받침된다.",
        "checks": [
          {"kind": "json_valid", "statement": "script.json 파싱"},
          {"kind": "field_present", "value": "narration", "statement": "내레이션 세그먼트 필드 존재"},
          {"kind": "min_items", "value": {"field": "narration", "min": 2}, "statement": "내레이션 세그먼트 ≥2(빈 대본 차단)"}
        ]
      },
      "review_focus": ["narration-clarity", "claim-traceability", "pacing"],
      "human_approval_default": true,
      "max_revisions": 5,
      "budget_minutes": 25
    },
    {
      "id": "scene-plan",
      "skill": "video-stitch",
      "produces": ["scene_plan.json"],
      "success_criteria": {
        "statement": "내레이션 세그먼트별 비주얼(이미지·다이어그램·모션)·온스크린 텍스트·음악 큐를 매핑한 씬 계획을 산출한다. 전 구간 비주얼 커버리지.",
        "checks": [
          {"kind": "json_valid", "statement": "scene_plan.json 파싱"},
          {"kind": "field_present", "value": "scenes", "statement": "씬 계획 필드 존재"},
          {"kind": "min_items", "value": {"field": "scenes", "min": 2}, "statement": "씬 ≥2(비주얼 커버리지)"}
        ]
      },
      "review_focus": ["visual-coverage", "narration-visual-sync", "diagram-clarity"],
      "human_approval_default": false,
      "max_revisions": 3,
      "budget_minutes": 20
    },
    {
      "id": "assets",
      "skill": "media-gen",
      "produces": ["asset_manifest.json"],
      "success_criteria": {
        "statement": "씬별 비주얼(이미지·다이어그램·모션 클립)·내레이션 tts·배경 음악을 준비한다. 생성 자산은 javis_select로 provider 선택(무키·로컬 바닥), 모든 계획 씬에 자산 존재.",
        "checks": [
          {"kind": "json_valid", "statement": "asset_manifest.json 파싱"}
        ]
      },
      "review_focus": ["visual-consistency", "tts-naturalness", "music-fit", "per-scene-assets"],
      "human_approval_default": false,
      "max_revisions": 3,
      "budget_minutes": 35
    },
    {
      "id": "edit",
      "skill": "video-stitch",
      "produces": ["edit_decisions.json"],
      "success_criteria": {
        "statement": "씬 타이밍·전환·내레이션/음악 믹스·온스크린 텍스트 스타일 편집 결정을 산출한다. render_runtime을 명시 고정(무음 swap=위반·SF-RENDER-RUNTIME-SWAP).",
        "checks": [
          {"kind": "json_valid", "statement": "edit_decisions.json 파싱"},
          {"kind": "field_present", "value": "render_runtime", "statement": "render_runtime 명시 고정(무음 swap 방지·SF-RENDER-RUNTIME-SWAP)"}
        ]
      },
      "review_focus": ["transition-smoothness", "audio-balance", "render-runtime-locked"],
      "human_approval_default": false,
      "max_revisions": 3,
      "budget_minutes": 20
    },
    {
      "id": "compose",
      "skill": "video-verify",
      "produces": ["render_report.json"],
      "success_criteria": {
        "statement": "비주얼·내레이션·음악 합성 후 render_report를 산출한다. render_runtime은 edit_decisions의 고정값과 일치해야 하며(무음 swap=CRITICAL 위반) ffprobe·시각/오디오 QA 통과를 기록한다.",
        "checks": [
          {"kind": "json_valid", "statement": "render_report.json 파싱"},
          {"kind": "field_present", "value": "render_runtime", "statement": "사용 런타임 기록(edit 고정값 대조·무음 swap 검출·SF-RENDER-RUNTIME-SWAP)"}
        ]
      },
      "review_focus": ["render-runtime-match", "playable", "audio-visual-sync", "visual-qa-pass"],
      "human_approval_default": true,
      "max_revisions": 5,
      "budget_minutes": 30
    },
    {
      "id": "publish",
      "skill": "youtube-video-pipeline",
      "produces": ["publish_log.json"],
      "success_criteria": {
        "statement": "메타데이터·익스포트 패키지(또는 게시 URL)를 산출한다.",
        "checks": [
          {"kind": "json_valid", "statement": "publish_log.json 파싱"}
        ]
      },
      "review_focus": ["metadata-complete"],
      "human_approval_default": false,
      "max_revisions": 2,
      "budget_minutes": 10
    }
  ]
}
