{
  "name": "animation",
  "version": "1.0",
  "description": "모션그래픽·키네틱 타이포·math 비주얼을 만드는 애니메이션 파이프라인. research→proposal→script→scene-plan→assets→edit→compose→publish. 능력=math-animate·diagram·tts·music. provider는 하드코딩 없이 javis_select로 선택, render_runtime(remotion/hyperframes/ffmpeg)은 proposal에 고정되고 무음 swap은 CRITICAL 위반.",
  "phases": [
    {
      "id": "research",
      "skill": "script-writer",
      "produces": ["brief.md"],
      "success_criteria": {
        "statement": "주제·수학/개념 정확성 근거·시각화 레퍼런스를 조사한 브리프를 작성한다(범위·출처 섹션 포함, 출처 명시).",
        "checks": [
          {"kind": "section_present", "value": "범위", "statement": "범위 섹션 존재"},
          {"kind": "section_present", "value": "출처", "statement": "출처 섹션 존재"},
          {"kind": "min_sources", "value": 2, "statement": "근거 출처 ≥2(무근거 시각화 차단)"}
        ]
      },
      "review_focus": ["scope-clarity", "math-accuracy", "source-grounding"],
      "human_approval_default": true,
      "max_revisions": 3,
      "budget_minutes": 20
    },
    {
      "id": "proposal",
      "skill": "script-writer",
      "produces": ["proposal.md"],
      "success_criteria": {
        "statement": "스타일·길이·render_runtime(remotion/hyperframes/ffmpeg 중 javis_select 위임 선택) 고정안을 제안한다(접근·런타임 섹션 포함). 이후 무음 swap은 위반.",
        "checks": [
          {"kind": "section_present", "value": "접근", "statement": "접근/스타일 섹션 존재"},
          {"kind": "section_present", "value": "런타임", "statement": "render_runtime 고정 섹션 존재"}
        ]
      },
      "review_focus": ["style-fit", "render-runtime-locked", "feasibility"],
      "human_approval_default": true,
      "max_revisions": 3,
      "budget_minutes": 15
    },
    {
      "id": "script",
      "skill": "script-writer",
      "produces": ["script.json"],
      "success_criteria": {
        "statement": "나레이션·온스크린 텍스트·비트별 타이밍을 가진 스크립트를 산출한다. 비트 배열이 존재하며 비어 있지 않다.",
        "checks": [
          {"kind": "json_valid", "statement": "script.json 파싱"},
          {"kind": "field_present", "value": "beats", "statement": "스크립트 비트 필드 존재"},
          {"kind": "min_items", "value": {"field": "beats", "min": 1}, "statement": "비트 ≥1(빈 스크립트 차단)"}
        ]
      },
      "review_focus": ["narration-clarity", "timing-realism"],
      "human_approval_default": false,
      "max_revisions": 3,
      "budget_minutes": 20
    },
    {
      "id": "scene-plan",
      "skill": "video-stitch-compositing",
      "produces": ["scene_plan.json"],
      "success_criteria": {
        "statement": "math-animate·diagram·키네틱 타이포 씬을 비트에 매핑한 씬 계획을 산출한다(씬별 모션·전환·지속시간). 씬 ≥2.",
        "checks": [
          {"kind": "json_valid", "statement": "scene_plan.json 파싱"},
          {"kind": "field_present", "value": "scenes", "statement": "씬 계획 필드 존재"},
          {"kind": "min_items", "value": {"field": "scenes", "min": 2}, "statement": "씬 ≥2(애니메이션 커버리지)"}
        ]
      },
      "review_focus": ["scene-coverage", "motion-feasibility", "math-visual-correctness"],
      "human_approval_default": false,
      "max_revisions": 3,
      "budget_minutes": 20
    },
    {
      "id": "assets",
      "skill": "media-gen",
      "produces": ["asset_manifest.json"],
      "success_criteria": {
        "statement": "다이어그램·math 비주얼 그래픽·나레이션 tts·배경 music 자산을 준비한다(생성 자산은 javis_select로 provider 선택, 무키 로컬 바닥). 모든 계획 씬에 자산 존재.",
        "checks": [
          {"kind": "json_valid", "statement": "asset_manifest.json 파싱"},
          {"kind": "field_present", "value": "assets", "statement": "자산 목록 필드 존재"},
          {"kind": "min_items", "value": {"field": "assets", "min": 1}, "statement": "자산 ≥1(빈 매니페스트 차단)"}
        ]
      },
      "review_focus": ["math-visual-accuracy", "tts-quality", "music-fit"],
      "human_approval_default": false,
      "max_revisions": 3,
      "budget_minutes": 30
    },
    {
      "id": "edit",
      "skill": "video-stitch-compositing",
      "produces": ["edit_decisions.json"],
      "success_criteria": {
        "statement": "씬별 모션 타이밍·전환·키프레임·자막/오디오 동기 편집 결정을 산출한다. render_runtime을 proposal 고정값으로 명시(무음 swap 방지).",
        "checks": [
          {"kind": "json_valid", "statement": "edit_decisions.json 파싱"},
          {"kind": "field_present", "value": "render_runtime", "statement": "render_runtime 명시 고정(proposal 대조·무음 swap 방지·SF-RENDER-RUNTIME-SWAP)"}
        ]
      },
      "review_focus": ["motion-timing", "render-runtime-locked", "audio-sync"],
      "human_approval_default": false,
      "max_revisions": 3,
      "budget_minutes": 25
    },
    {
      "id": "compose",
      "skill": "video-verify",
      "produces": ["render_report.json"],
      "success_criteria": {
        "statement": "합성·오디오믹스(tts+music) 후 render_report를 산출한다. render_runtime은 edit_decisions의 고정값과 일치해야 하며(무음 swap=CRITICAL 위반) ffprobe·시각 QA 통과를 기록한다.",
        "checks": [
          {"kind": "json_valid", "statement": "render_report.json 파싱"},
          {"kind": "field_present", "value": "render_runtime", "statement": "사용 런타임 기록(edit 고정값 대조·무음 swap 검출·SF-RENDER-RUNTIME-SWAP)"}
        ]
      },
      "review_focus": ["render-runtime-match", "motion-smoothness", "visual-qa-pass"],
      "human_approval_default": true,
      "max_revisions": 5,
      "budget_minutes": 35
    },
    {
      "id": "publish",
      "skill": "youtube-video-pipeline",
      "produces": ["publish_log.json"],
      "success_criteria": {
        "statement": "메타데이터·익스포트 패키지(또는 게시 URL)를 산출한다.",
        "checks": [
          {"kind": "json_valid", "statement": "publish_log.json 파싱"}
        ]
      },
      "review_focus": ["metadata-complete"],
      "human_approval_default": false,
      "max_revisions": 2,
      "budget_minutes": 10
    }
  ]
}
